{
  "$schema": "./internal-production-readiness-ledger.schema.json",
  "schema_version": 1,
  "template": true,
  "generated_at": null,
  "release": {
    "git_revision": null,
    "image_digest": null,
    "bundle_sha256": null,
    "environment_id": null
  },
  "production_ready": false,
  "decision": {
    "status": "pending",
    "decided_at": null,
    "expires_at": null,
    "approver": null,
    "evidence_uri": null,
    "notes": "Template only. Copy to the restricted release evidence store, set template to false, and bind every receipt to one immutable release."
  },
  "gates": [
    {
      "id": "application.code_quality",
      "category": "application",
      "title": "Code quality and build gates",
      "status": "pending",
      "owner": null,
      "approver": null,
      "assessed_at": null,
      "review_due_at": null,
      "evidence_uri": null,
      "notes": "Formatting, lint, typecheck, tests, contracts, documentation, architecture checks, and production build."
    },
    {
      "id": "application.security",
      "category": "application",
      "title": "Application security gates",
      "status": "pending",
      "owner": null,
      "approver": null,
      "assessed_at": null,
      "review_due_at": null,
      "evidence_uri": null,
      "notes": "Repository scans, boundary suites, independent review, and finding disposition for the exact release."
    },
    {
      "id": "application.browser_usability",
      "category": "application",
      "title": "Browser usability and automated accessibility",
      "status": "pending",
      "owner": null,
      "approver": null,
      "assessed_at": null,
      "review_due_at": null,
      "evidence_uri": null,
      "notes": "Desktop/mobile journeys and representative-state accessibility automation."
    },
    {
      "id": "application.delivery_correctness",
      "category": "application",
      "title": "Delivery correctness",
      "status": "pending",
      "owner": null,
      "approver": null,
      "assessed_at": null,
      "review_due_at": null,
      "evidence_uri": null,
      "notes": "Authenticated send, replay, reconnect, search, attachment, provider, and administration journeys."
    },
    {
      "id": "application.data_change",
      "category": "application",
      "title": "Migration and data-change safety",
      "status": "pending",
      "owner": null,
      "approver": null,
      "assessed_at": null,
      "review_due_at": null,
      "evidence_uri": null,
      "notes": "Fresh migration, timing, compatibility window, rollback boundary, and reapply evidence."
    },
    {
      "id": "application.runtime_resilience",
      "category": "application",
      "title": "Runtime resilience",
      "status": "pending",
      "owner": null,
      "approver": null,
      "assessed_at": null,
      "review_due_at": null,
      "evidence_uri": null,
      "notes": "Production topology, readiness, replacement, reconvergence, and no acknowledged-message loss."
    },
    {
      "id": "application.recovery",
      "category": "application",
      "title": "Application recovery",
      "status": "pending",
      "owner": null,
      "approver": null,
      "assessed_at": null,
      "review_due_at": null,
      "evidence_uri": null,
      "notes": "PostgreSQL and object-storage backup, isolated restore, reconciliation, and attachment verification."
    },
    {
      "id": "application.release_safety",
      "category": "application",
      "title": "Release safety and immutable artifact",
      "status": "pending",
      "owner": null,
      "approver": null,
      "assessed_at": null,
      "review_due_at": null,
      "evidence_uri": null,
      "notes": "Signed digest, retained bundle, provenance, rollback, roll-forward, and final release evidence."
    },
    {
      "id": "environment.infrastructure",
      "category": "environment",
      "title": "Approved infrastructure composition",
      "status": "pending",
      "owner": null,
      "approver": null,
      "assessed_at": null,
      "review_due_at": null,
      "evidence_uri": null,
      "notes": "Provisioned from reviewed provider composition with drift and access controls."
    },
    {
      "id": "environment.postgresql",
      "category": "environment",
      "title": "Managed PostgreSQL durability",
      "status": "pending",
      "owner": null,
      "approver": null,
      "assessed_at": null,
      "review_due_at": null,
      "evidence_uri": null,
      "notes": "Encryption, hostname-verified TLS, PITR, capacity monitoring, independent backup, and restore drill."
    },
    {
      "id": "environment.object_storage",
      "category": "environment",
      "title": "Durable object storage",
      "status": "pending",
      "owner": null,
      "approver": null,
      "assessed_at": null,
      "review_due_at": null,
      "evidence_uri": null,
      "notes": "Versioning, lifecycle, encryption, restricted credentials, restore, and reconciliation."
    },
    {
      "id": "environment.providers",
      "category": "environment",
      "title": "Approved external providers",
      "status": "pending",
      "owner": null,
      "approver": null,
      "assessed_at": null,
      "review_due_at": null,
      "evidence_uri": null,
      "notes": "Real notification, Web Push, webhook egress, and malware-scanning providers; development adapters do not pass."
    },
    {
      "id": "environment.secrets",
      "category": "environment",
      "title": "External secret and key ownership",
      "status": "pending",
      "owner": null,
      "approver": null,
      "assessed_at": null,
      "review_due_at": null,
      "evidence_uri": null,
      "notes": "Scoped external ownership, access review, rotation, revocation, and exclusion from source, images, and logs."
    },
    {
      "id": "environment.network_and_observability",
      "category": "environment",
      "title": "DNS, TLS, ingress, network, and observability",
      "status": "pending",
      "owner": null,
      "approver": null,
      "assessed_at": null,
      "review_due_at": null,
      "evidence_uri": null,
      "notes": "Trusted endpoints, calibrated limits, restricted policies, authenticated metrics, and internal-client verification."
    },
    {
      "id": "environment.corporate_authentication",
      "category": "environment",
      "title": "Corporate authentication policy",
      "status": "pending",
      "owner": null,
      "approver": null,
      "assessed_at": null,
      "review_due_at": null,
      "evidence_uri": null,
      "notes": "Approved local-password compensating controls or separately implemented and approved corporate OIDC/MFA."
    },
    {
      "id": "environment.performance_and_resilience",
      "category": "environment",
      "title": "Production-scale performance and resilience",
      "status": "pending",
      "owner": null,
      "approver": null,
      "assessed_at": null,
      "review_due_at": null,
      "evidence_uri": null,
      "notes": "Peak-plus-headroom load, soak, reconnect, provider outage/recovery, node loss, and zone loss."
    },
    {
      "id": "environment.alerting",
      "category": "environment",
      "title": "Alert routing and actionability",
      "status": "pending",
      "owner": null,
      "approver": null,
      "assessed_at": null,
      "review_due_at": null,
      "evidence_uri": null,
      "notes": "Real receiver delivery and versioned owner, query, mitigation, stop, validation, escalation, and runbook context."
    },
    {
      "id": "environment.operating_authority",
      "category": "environment",
      "title": "Operating ownership and exercised authority",
      "status": "pending",
      "owner": null,
      "approver": null,
      "assessed_at": null,
      "review_due_at": null,
      "evidence_uri": null,
      "notes": "Release, rollback, recovery, security/privacy, support, incident command, and communication authority."
    },
    {
      "id": "environment.data_policy",
      "category": "environment",
      "title": "Data and support-access policy",
      "status": "pending",
      "owner": null,
      "approver": null,
      "assessed_at": null,
      "review_due_at": null,
      "evidence_uri": null,
      "notes": "Classification, retention, legal hold, deletion, audit access, evidence handling, and support-content access."
    },
    {
      "id": "environment.budget",
      "category": "environment",
      "title": "Capacity, provider, telemetry, and pilot budget",
      "status": "pending",
      "owner": null,
      "approver": null,
      "assessed_at": null,
      "review_due_at": null,
      "evidence_uri": null,
      "notes": "Approved capacity headroom, provider costs, observability retention, and pilot funding."
    },
    {
      "id": "people.representative_study",
      "category": "people",
      "title": "Representative twelve-person study",
      "status": "pending",
      "owner": null,
      "approver": null,
      "assessed_at": null,
      "review_due_at": null,
      "evidence_uri": null,
      "notes": "Required participant mix, synthetic data, privacy contract, task evidence, SUS, and accessibility cohorts."
    },
    {
      "id": "people.usability_score",
      "category": "people",
      "title": "Usability score gate",
      "status": "pending",
      "owner": null,
      "approver": null,
      "assessed_at": null,
      "review_due_at": null,
      "evidence_uri": null,
      "notes": "The exact-candidate structured study passes scripts/score_usability_study.mjs."
    },
    {
      "id": "people.manual_accessibility",
      "category": "people",
      "title": "Manual accessibility audit",
      "status": "pending",
      "owner": null,
      "approver": null,
      "assessed_at": null,
      "review_due_at": null,
      "evidence_uri": null,
      "notes": "Manual WCAG 2.2 A/AA and assistive-technology matrix with no unresolved critical or serious defect."